{
  "schema": "rrs.transcript.raw/1",
  "source_id": "S003",
  "transcript_file": "Tomasz Wojtyczko, Principal Recruitment Consultant at VirtueTech.md",
  "transcript_sha256": "76aee737c50dcc8069d29221159e108cb59e89f434f222787c7fb0cbbea23e2f",
  "title": "How Recruiters Really Screen Your Resume and How to Stand Out?",
  "timing": "turn",
  "speakers": {
    "Guest": "TW",
    "Interviewer": "JA"
  },
  "overrides_applied": [],
  "turns": [
    {
      "n": 1,
      "label": "Interviewer",
      "person": "JA",
      "start": 0.0,
      "text": "hello Hello everyone and hi Tomas How are you doing"
    },
    {
      "n": 2,
      "label": "Guest",
      "person": "TW",
      "start": 2.0,
      "text": "I'm all good I'm all good Thank you for having me on Really appreciate it"
    },
    {
      "n": 3,
      "label": "Interviewer",
      "person": "JA",
      "start": 5.0,
      "text": "Thanks for joining Thanks Thanks for joining Okay Tomas do you want to introduce yourself and tell a bit about your background and what you do"
    },
    {
      "n": 4,
      "label": "Guest",
      "person": "TW",
      "start": 11.0,
      "text": "Yeah absolutely So I've been um recruiting within tech data and product for over five years now um all the way from stealth startups to conglomerates like within finance um across both sides of the of the sector I guess and um a apart from that I've been obviously advising companies on the branding as well as the hiring strategies and how to actually put themselves out into the market So I have a good understanding of how companies think how they what they want to see but at the same time literally working directly with them on what the requirements are how CV should be presented and how to best put yourself forward"
    },
    {
      "n": 5,
      "label": "Interviewer",
      "person": "JA",
      "start": 36.0,
      "text": "Okay cool So now first of all how what is your mindset as a recruiter when you want when you see a resume What is the first thing the first five to 10 second that you are doing What you actually do and what you think what you're looking for after"
    },
    {
      "n": 6,
      "label": "Guest",
      "person": "TW",
      "start": 48.0,
      "text": "Yeah absolutely So I think the first thing and it always stands out is the formatting And by that I mean when it opens up that's the first thing you notice Um it's literally how it's formatted Are there too many colors I think managers don't like seeing too many colors They prefer very streamlined easy to read CV So such as bold um underlined titles when it comes to jobs And then obviously companies people I've worked at those are like that is the first thing that I see um and it does stand out very quickly if someone's formatted the CV in an easy to read way Um the second thing is obviously looking at uh job titles that is but I think the best way to explain it is yeah the formatting is like the full page then you look down a bit deeper and that's the job title make it and obviously the job titles can be different so that's perfectly fine someone might call someone else might call themselves a front end engineer that's okay but I just want to make sure it's been at least uh left field and then look even deeper into that If that looks good pick out certain technologies Make sure the technologies match Make sure if it's a front end technology job it's not backend technology I'm seeing everywhere no front end because that obviously rules it out quite quickly And then to go even deeper after that is to see the sort of impact the contributions they've had um the achievements the statistics uh for example of how much they reduce crash rates things like that Really looking for that detail However I think the last part and this is very important Me as an external recruiter it's my job to help people fix CVS as well So I do not judge someone fully on that I I am happy to sit down with them and fix it for the with them literally on teams Um and make sure that they present themselves the best way to the manager but obviously this fully depends on the requirements Um if it's a financial firm I'm looking for fintech finance experience stuff like that as well depending on what the manager has told me Um but that's the best way to put it there outside view going deep in uh bit by bit of what I'm looking at"
    },
    {
      "n": 7,
      "label": "Interviewer",
      "person": "JA",
      "start": 171.0,
      "text": "Okay cool So is it any way that people now from audience can become your clients and work with you to fix their CV and get a job"
    },
    {
      "n": 8,
      "label": "Guest",
      "person": "TW",
      "start": 180.0,
      "text": "Absolutely I'm I'm always looking at things on the side especially because I think it always keeps me moving and updated I see I see so many CVs and then when I see a new one I'm like this is actually a really nice way of writing a CV and you learn from so many different people Um I don't think there's one way of writing a CV Hence why and I'm sure we'll go on to the topic of AI I'm I'm not a fan of AI CVs and managers do pick on it very very quickly Um but at the same time I think when I whenever I look at CVs people speak them to me on LinkedIn um from all over the world I I'm always happy to have a look and suggest a few things here and there that could be fixed Um I think after looking I have definitely over 100,000 CVs in my life I think I pick out things very quickly now just jumping through and seeing what I can uh notice Um so I think it doesn't require so much time off me basically but I usually do that kind of outside of work sometimes on the weekends when I'm on LinkedIn anyway and someone just sends me a message Um so yeah I think definitely that is a possibility Yeah absolutely"
    },
    {
      "n": 9,
      "label": "Interviewer",
      "person": "JA",
      "start": 246.0,
      "text": "Okay cool So how you scan So is it like the first ATS that you are using ATS to filter the CVs and then after that you review it by yourself You right"
    },
    {
      "n": 10,
      "label": "Guest",
      "person": "TW",
      "start": 255.0,
      "text": "No no I actually do it all manually So I was very So um we post jobs on behalf obviously of clients but like an anonymity in terms of who the client is So no other agency takes it from us but it's usually on LinkedIn So our jobs pop up on LinkedIn uh well we use LinkedIn recruiter to post a job and then I link it to my email So all the CVs that are coming in come through to my email Now LinkedIn does do a there is a feature on LinkedIn where you can actually go back and filter them by how many of the keywords they have I don't really really do that I'm very um yeah I hate notifications So if my email has notifications or unread things I have to click it and I have to check it But the good thing is on the side it will show me the background like literally their LinkedIn profile on the email and then I can click the CV because it's usually attached So obviously we do you do get applications that are completely outside of engineering looking to get into engineering and if it's a senior role I know that there's not really going to make much sense and I I genuinely mean completely not engineering Someone's never done it before However uh obviously if it looks interesting then I can just click the CV and have a look quickly for myself as well Um so I am pretty old with manually doing it We don't run ATS Um our clients do but myself personally no I I have to look through it myself"
    },
    {
      "n": 11,
      "label": "Interviewer",
      "person": "JA",
      "start": 343.0,
      "text": "Okay So now what is the problem with AI If all the companies are now laying off because of AI what's the problem if we write or CV with AI"
    },
    {
      "n": 12,
      "label": "Guest",
      "person": "TW",
      "start": 351.0,